{
  "schema_version": "2.0.0",
  "format": "draw_tool.document",
  "document_id": "doc-0108",
  "name": "Untitled",
  "canvas": {
    "tile_px": 64,
    "unit_px": 32,
    "width_px": 128,
    "height_px": 128,
    "background": "transparent"
  },
  "active_layer_id": "layer-0001",
  "layers": [
    {
      "layer_id": "layer-0001",
      "name": "Layer 1",
      "type": "raster",
      "visible": true,
      "locked": false,
      "opacity": 1,
      "blend": "normal",
      "raster": {
        "chunk_px": 32,
        "encoding": "png_base64",
        "chunks": [
          {
            "cx": 1,
            "cy": 3,
            "png": "iVBORw0KGgoAAAANSUhEUgAAACAAAAAgCAYAAABzenr0AAAAXElEQVR4nGNgGAWjYBSMAhoALn7JVcRimltAsQOoaRnRDqC1pTgdQE+LMRwwEJaPOmBwpYFBkQvwOcZi74//xGKqOgAZkOIIYjFJDqCFA6nqgFEwCkbBKBgF5AAAYChquGPIcbQAAAAASUVORK5CYII="
          },
          {
            "cx": 2,
            "cy": 3,
            "png": "iVBORw0KGgoAAAANSUhEUgAAACAAAAAgCAYAAABzenr0AAAAW0lEQVR4nGNgGAWjYBSMeMDFL7mKFDzgDqC6A6ntAJIdRQ8H4HUMvR2A4ZCBcgDcEaMOGHFpgKJcYLH3x39SME5LkQGphhKLCZaAlDqAaAtGwSgYBaNgFAx2AAB133wUieGwkQAAAABJRU5ErkJggg=="
          }
        ]
      }
    }
  ]
}