{
  "schema_version": "2.0.0",
  "format": "draw_tool.document",
  "document_id": "doc-0059",
  "name": "Untitled",
  "canvas": {
    "tile_px": 64,
    "unit_px": 32,
    "width_px": 2048,
    "height_px": 128,
    "background": "transparent"
  },
  "active_layer_id": "layer-0001",
  "layers": [
    {
      "layer_id": "layer-0001",
      "name": "Layer 1",
      "type": "raster",
      "visible": true,
      "locked": false,
      "opacity": 1,
      "blend": "normal",
      "raster": {
        "chunk_px": 32,
        "encoding": "png_base64",
        "chunks": [
          {
            "cx": 1,
            "cy": 1,
            "png": "iVBORw0KGgoAAAANSUhEUgAAACAAAAAgCAYAAABzenr0AAAAWklEQVR4nO3RQQrAIAxE0VyzF+ypepfpKhtRaSkxqfwPLnUeaEZERER/7TildICfdEAqpgxkhAkbk3T1zjKIj80K/Z4eYDQYAmkBb8fDAE/u7gH48igAAKUAN71QNFi6kfz7AAAAAElFTkSuQmCC"
          },
          {
            "cx": 2,
            "cy": 1,
            "png": "iVBORw0KGgoAAAANSUhEUgAAACAAAAAgCAYAAABzenr0AAAAT0lEQVR4nO2RMQoAIAzE/KYf9FX+5Zy6uKhorWACtzaBpgQAAAC/kosUJraFSK8GPCV2l86IJdV+LtLQ/44WHnAswg6tHHV5DwEEELAb0AC1fiwzVLeygwAAAABJRU5ErkJggg=="
          },
          {
            "cx": 3,
            "cy": 1,
            "png": "iVBORw0KGgoAAAANSUhEUgAAACAAAAAgCAYAAABzenr0AAAAI0lEQVR4nO3OAQEAAAgCIP9v7IsNERaQAAAwr+0JCGwHYN4DYecXF38CBhYAAAAASUVORK5CYII="
          },
          {
            "cx": 1,
            "cy": 2,
            "png": "iVBORw0KGgoAAAANSUhEUgAAACAAAAAgCAYAAABzenr0AAAAQElEQVR4nO3OwQkAIAxD0a7pgk7lLhHvXiKBHvwPciv0V4WMKZ2lb+0AZ9EANyL+HPiPpEUAAe0Bt7VGAQAAvNgK6X4Ahwk/FwAAAABJRU5ErkJggg=="
          },
          {
            "cx": 2,
            "cy": 2,
            "png": "iVBORw0KGgoAAAANSUhEUgAAACAAAAAgCAYAAABzenr0AAAAQklEQVR4nO3RsQkAIBBD0VvTBZ3KXSK2dsHINf9BOuE+WPVoTOks/dYOcBYNcCPixxHV/pftAQB+k7TudTcBAADUBsgyqKhgW0a2AAAAAElFTkSuQmCC"
          },
          {
            "cx": 3,
            "cy": 2,
            "png": "iVBORw0KGgoAAAANSUhEUgAAACAAAAAgCAYAAABzenr0AAAAJElEQVR4nO3OMQEAAAgDIPtntMuMsUNIwAxAW5IVEPgdAABoO2BZFxfsVqoqAAAAAElFTkSuQmCC"
          }
        ]
      }
    }
  ]
}