{
  "schema_version": "2.0.0",
  "format": "draw_tool.document",
  "document_id": "doc-0043",
  "name": "Untitled",
  "canvas": {
    "tile_px": 64,
    "unit_px": 32,
    "width_px": 2048,
    "height_px": 128,
    "background": "transparent"
  },
  "active_layer_id": "layer-0001",
  "layers": [
    {
      "layer_id": "layer-0001",
      "name": "Layer 1",
      "type": "raster",
      "visible": true,
      "locked": false,
      "opacity": 1,
      "blend": "normal",
      "raster": {
        "chunk_px": 32,
        "encoding": "png_base64",
        "chunks": [
          {
            "cx": 1,
            "cy": 1,
            "png": "iVBORw0KGgoAAAANSUhEUgAAACAAAAAgCAYAAABzenr0AAAAaElEQVR4nO3UwQnAIBBEUatJHem/hvQyIYfc3M2S6Ejgf/Ak6EPU1oiIiIj+nrZdywH3WA6wYiQd3eGCXJuFc44TyQAWSAWQQT5jeoCnRYciIkB18Sl3Izpq2x+RATxPswiYhgHwBnACO3QzvzjZUy8AAAAASUVORK5CYII="
          },
          {
            "cx": 2,
            "cy": 1,
            "png": "iVBORw0KGgoAAAANSUhEUgAAACAAAAAgCAYAAABzenr0AAAAWklEQVR4nO2SsQkAIAzAvMY7/P8Gf6mTi4q0olUwgU4dEkpDAAAAAPgViUmuietckboGdFKR3I6P2Ovcb5zZKl6tXBEP9zsCLKFbA7RSl5+YSY8FaKUEPB1QAJ8RKwF426juAAAAAElFTkSuQmCC"
          },
          {
            "cx": 3,
            "cy": 1,
            "png": "iVBORw0KGgoAAAANSUhEUgAAACAAAAAgCAYAAABzenr0AAAAI0lEQVR4nO3OAQEAAAgCIP9v7IsNERaQAAAwr+0JCGwHYN4DYecXF38CBhYAAAAASUVORK5CYII="
          },
          {
            "cx": 1,
            "cy": 2,
            "png": "iVBORw0KGgoAAAANSUhEUgAAACAAAAAgCAYAAABzenr0AAAARElEQVR4nO3OsQ0AIAwDwUzDHOw/A7uYBaAwCknzJ7n2RyTSmHKX+W9HpJ87Ed/Ob0Glh0AJSYsAAtoDTmuNAgAAeLEBaUN7nOAZiI4AAAAASUVORK5CYII="
          },
          {
            "cx": 2,
            "cy": 2,
            "png": "iVBORw0KGgoAAAANSUhEUgAAACAAAAAgCAYAAABzenr0AAAAS0lEQVR4nO3TwQ0AIAhDUaZxDvefwV3q3cQDQerlv4RzmwARBRpT2anklUs8D8+UaAu/FbIGws66Y+tVf38h3gfdJK1zfncCAACIDYdehf6tkj0XAAAAAElFTkSuQmCC"
          },
          {
            "cx": 3,
            "cy": 2,
            "png": "iVBORw0KGgoAAAANSUhEUgAAACAAAAAgCAYAAABzenr0AAAAJElEQVR4nO3OMQEAAAgDIPtntMuMsUNIwAxAW5IVEPgdAABoO2BZFxfsVqoqAAAAAElFTkSuQmCC"
          }
        ]
      }
    }
  ]
}