{
  "schema_version": "2.0.0",
  "format": "draw_tool.document",
  "document_id": "doc-0029",
  "name": "Untitled",
  "canvas": {
    "tile_px": 64,
    "unit_px": 32,
    "width_px": 2048,
    "height_px": 128,
    "background": "transparent"
  },
  "active_layer_id": "layer-0001",
  "layers": [
    {
      "layer_id": "layer-0001",
      "name": "Layer 1",
      "type": "raster",
      "visible": true,
      "locked": false,
      "opacity": 1,
      "blend": "normal",
      "raster": {
        "chunk_px": 32,
        "encoding": "png_base64",
        "chunks": [
          {
            "cx": 1,
            "cy": 1,
            "png": "iVBORw0KGgoAAAANSUhEUgAAACAAAAAgCAYAAABzenr0AAAANUlEQVR4nO3OoREAIBADQRqkf0MBdBEawDziMbsz0bkxAADgUZJ1W2tA25kAAVCRPVPZ94ADH0R3HHDek2IAAAAASUVORK5CYII="
          },
          {
            "cx": 2,
            "cy": 1,
            "png": "iVBORw0KGgoAAAANSUhEUgAAACAAAAAgCAYAAABzenr0AAAAM0lEQVR4nO3OoQ0AIBRDwb8g+xsGYIvicSAAcZc82aRVAABwUZK+9voTQFVGy+luty8PTGZ4bNIkk6j+AAAAAElFTkSuQmCC"
          },
          {
            "cx": 3,
            "cy": 1,
            "png": "iVBORw0KGgoAAAANSUhEUgAAACAAAAAgCAYAAABzenr0AAAAI0lEQVR4nO3OAQEAAAgCIP9v7IsNERaQAAAwr+0JCGwHYN4DYecXF38CBhYAAAAASUVORK5CYII="
          },
          {
            "cx": 1,
            "cy": 2,
            "png": "iVBORw0KGgoAAAANSUhEUgAAACAAAAAgCAYAAABzenr0AAAAN0lEQVR4nO3OsQkAIBRDQRd0/8YB3CIuYKMIv/AOUue19lhmz8le/wMfSTIECCgP2K00CgDgxgIY3VC4wMg1ZwAAAABJRU5ErkJggg=="
          },
          {
            "cx": 2,
            "cy": 2,
            "png": "iVBORw0KGgoAAAANSUhEUgAAACAAAAAgCAYAAABzenr0AAAAPElEQVR4nO3UsQ0AIAwDQS/I/g0DsIURbToigZs/yWVkV5HXsBrO3W06PQDwX/yTxQfgJduzJr0JAABAG7MBbNKjER9DAAAAAElFTkSuQmCC"
          },
          {
            "cx": 3,
            "cy": 2,
            "png": "iVBORw0KGgoAAAANSUhEUgAAACAAAAAgCAYAAABzenr0AAAAJElEQVR4nO3OMQEAAAgDIPtntMuMsUNIwAxAW5IVEPgdAABoO2BZFxfsVqoqAAAAAElFTkSuQmCC"
          }
        ]
      }
    }
  ]
}