{
  "schema_version": "2.0.0",
  "format": "draw_tool.document",
  "document_id": "doc-0101",
  "name": "Untitled",
  "canvas": {
    "tile_px": 64,
    "unit_px": 32,
    "width_px": 128,
    "height_px": 128,
    "background": "transparent"
  },
  "active_layer_id": "layer-0001",
  "layers": [
    {
      "layer_id": "layer-0001",
      "name": "Layer 1",
      "type": "raster",
      "visible": true,
      "locked": false,
      "opacity": 1,
      "blend": "normal",
      "raster": {
        "chunk_px": 32,
        "encoding": "png_base64",
        "chunks": [
          {
            "cx": 2,
            "cy": 0,
            "png": "iVBORw0KGgoAAAANSUhEUgAAACAAAAAgCAYAAABzenr0AAAAYklEQVR4nO3TyQkAIAxEUcuyefvypiAIInHPgjAf5px3iXMIIYQQQj/kQ0zmgDpzgAmEAqhCZgAVRHesTBVCAUYIEcgIoAZZAcQhuwAxyCmAHXILYIO8Ap5flwtAQUwALSIDVCSWeJY90LQAAAAASUVORK5CYII="
          },
          {
            "cx": 3,
            "cy": 0,
            "png": "iVBORw0KGgoAAAANSUhEUgAAACAAAAAgCAYAAABzenr0AAAAKUlEQVR4nO3OsQ0AMAjAMM7i+f7FBuoVDNhS9kQAAADAefmqf+sDWyMDUtERiWHMw44AAAAASUVORK5CYII="
          },
          {
            "cx": 2,
            "cy": 1,
            "png": "iVBORw0KGgoAAAANSUhEUgAAACAAAAAgCAYAAABzenr0AAAAa0lEQVR4nO3USwoAIAgE0DlWl+9e7WoVRCi1yA80gUv1ESpw8UptfQaA10EAAQQQQAABBHwI2Or4AZQ69oA13w0gNVXy3wIum/oAQrYg/AfCZyDNFqS6AxIkFOA+A+kAWz1bgLaOJoBTMykGoZcXREr40wQAAAAASUVORK5CYII="
          },
          {
            "cx": 3,
            "cy": 1,
            "png": "iVBORw0KGgoAAAANSUhEUgAAACAAAAAgCAYAAABzenr0AAAAQ0lEQVR4nO3XMQoAIAwDQJ/l5/2Xm+IqnVvBC2TOrWl9zBW1JeaM1QNuBAAAAAAAAAAAAAAAwF+A0m9Yfk6fAKSNBdmF4IZ3aKUUcAAAAABJRU5ErkJggg=="
          },
          {
            "cx": 2,
            "cy": 2,
            "png": "iVBORw0KGgoAAAANSUhEUgAAACAAAAAgCAYAAABzenr0AAAARElEQVR4nO3OIQ4AIAwEwXsWn+dfOFAQBCRtoFU7SU3NnmRQauvzJK3b/56zNK8DwmMvA77EPAPCgqcBaTEAAAAAQLYBZJuSKt4cl68AAAAASUVORK5CYII="
          }
        ]
      }
    }
  ]
}