{
  "schema_version": "2.0.0",
  "format": "draw_tool.document",
  "document_id": "doc-0027",
  "name": "Untitled",
  "canvas": {
    "tile_px": 64,
    "unit_px": 32,
    "width_px": 2048,
    "height_px": 128,
    "background": "transparent"
  },
  "active_layer_id": "layer-0001",
  "layers": [
    {
      "layer_id": "layer-0001",
      "name": "Layer 1",
      "type": "raster",
      "visible": true,
      "locked": false,
      "opacity": 1,
      "blend": "normal",
      "raster": {
        "chunk_px": 32,
        "encoding": "png_base64",
        "chunks": [
          {
            "cx": 1,
            "cy": 1,
            "png": "iVBORw0KGgoAAAANSUhEUgAAACAAAAAgCAYAAABzenr0AAAAYklEQVR4nO3SMQ4AEBBEURd0/8YB3GJEocFuxSzJ/ESjmReRklJKKaV+DjUjdHyc0PHnIE8gKBAAZXtYiD623DFfYwfwIFSAhTgKsQDzyDWEB5iHuH/DGeP8DQNAewUBvgM0bnzAsD7np0gAAAAASUVORK5CYII="
          },
          {
            "cx": 2,
            "cy": 1,
            "png": "iVBORw0KGgoAAAANSUhEUgAAACAAAAAgCAYAAABzenr0AAAAXUlEQVR4nO2RsQ0AIAgEWdD9GwdwC6xsjMRolMf4l9B6B4oQQggh5Ge0JIXKIQFNDAno5W4BIzFGrpr78RFHODlMHGbrayGzra9ewhIvfcVOnSWYjfnYqe0Z8GRABUJ+xmUwnGiOAAAAAElFTkSuQmCC"
          },
          {
            "cx": 3,
            "cy": 1,
            "png": "iVBORw0KGgoAAAANSUhEUgAAACAAAAAgCAYAAABzenr0AAAALklEQVR4nO3OMQEAIAwDsBnE/4MAXBQZO5ooyAwAUC/vZD2wnuiW5AoIdAeg3gdqhSCwIPxIPgAAAABJRU5ErkJggg=="
          },
          {
            "cx": 1,
            "cy": 2,
            "png": "iVBORw0KGgoAAAANSUhEUgAAACAAAAAgCAYAAABzenr0AAAAOUlEQVR4nO3OsQkAIBRDQRd0/8YB3CIuYKMIv/AOUue19lhmz8le/wsQwEeSDAECygN2K40CALixALhJ6kgowSohAAAAAElFTkSuQmCC"
          },
          {
            "cx": 2,
            "cy": 2,
            "png": "iVBORw0KGgoAAAANSUhEUgAAACAAAAAgCAYAAABzenr0AAAAQElEQVR4nO3SoQ0AIAxE0VuQ/Q0DsMURBIYEAeZE/0sq23xReTTrw9p7neshAmoHAFv8meIBKMF2PyfdBAAAoAma+zmhpp5T5AAAAABJRU5ErkJggg=="
          },
          {
            "cx": 3,
            "cy": 2,
            "png": "iVBORw0KGgoAAAANSUhEUgAAACAAAAAgCAYAAABzenr0AAAAJElEQVR4nO3OMQEAAAgDIPtntMuMsUNIwAxAW5IVEPgdAABoO2BZFxfsVqoqAAAAAElFTkSuQmCC"
          }
        ]
      }
    }
  ]
}